{
	"$schema": "https://raw.githubusercontent.com/xsyetopz/OpenJoystickDriver/main/Resources/Schemas/device-profile.schema.json",
	"vendor_id": 13623,
	"product_id": 4112,
	"name": "GameSir-G7 SE Controller for Xbox",
	"protocol": "GIP",
	"usb": {
		"interface": 0,
		"class": 255,
		"subclass": 93,
		"endpoints": {
			"out": {
				"address": 2,
				"type": "interrupt",
				"max_packet": 64
			},
			"in": {
				"address": 130,
				"type": "interrupt",
				"max_packet": 64
			}
		}
	},
	"init_sequence": [
		{
			"step": 1,
			"packet": [
				5,
				32,
				0,
				1,
				0
			],
			"timeout_ms": 2000
		},
		{
			"step": 2,
			"packet": [
				10,
				32,
				0,
				3,
				0,
				1,
				20
			],
			"timeout_ms": 2000
		},
		{
			"step": 3,
			"packet": [
				6,
				32,
				0,
				2,
				1,
				0
			],
			"timeout_ms": 2000
		}
	],
	"input_commands": {
		"input": {
			"cmd": 32,
			"payload_layout": {
				"buttons_0": {
					"offset": 0,
					"bits": {
						"start": 4,
						"back": 8,
						"a": 16,
						"b": 32,
						"x": 64,
						"y": 128
					}
				},
				"buttons_1": {
					"offset": 1,
					"bits": {
						"dpad_up": 1,
						"dpad_down": 2,
						"dpad_left": 4,
						"dpad_right": 8,
						"lb": 16,
						"rb": 32,
						"lstick": 64,
						"rstick": 128
					}
				},
				"lt": {
					"offset": 2,
					"size": 2,
					"type": "uint16_le",
					"range": [
						0,
						1023
					]
				},
				"rt": {
					"offset": 4,
					"size": 2,
					"type": "uint16_le",
					"range": [
						0,
						1023
					]
				},
				"lsx": {
					"offset": 6,
					"size": 2,
					"type": "int16_le",
					"center": 0
				},
				"lsy": {
					"offset": 8,
					"size": 2,
					"type": "int16_le",
					"center": 0,
					"inverted": true
				},
				"rsx": {
					"offset": 10,
					"size": 2,
					"type": "int16_le",
					"center": 0
				},
				"rsy": {
					"offset": 12,
					"size": 2,
					"type": "int16_le",
					"center": 0,
					"inverted": true
				}
			}
		},
		"virtual_key": {
			"cmd": 7,
			"fields": {
				"guide": {
					"offset": 0,
					"mask": 3
				}
			}
		}
	}
}
